,Tweet Body ,Sentiment ,processed_content
452,i hate how you cant romanticize bulimia like ana,Negative,hate how you cant romanticize bulimia like ana
453,i got a feeling that 1 of them have bulimia,Negative,got feeling that them have bulimia
454,me trying to beat the bulimia allegations,Neutral,trying beat the bulimia allegations
455,Do normal people think bulimia is gross or just sad?,Neutral,normal people think bulimia gross just
456,Poor hygiene or bulimia? Any Dentist out there who can weigh in on this?,Neutral,poor hygiene any dentist out there who can weigh
457,"romanticising anorexia and bulimia by giving them cute names like ana and mia makes it seem like they're our friends. instead, we should call our eds Ed and pretend it's an old ugly man who in fact doesn't want us to feel okay and is a THREAT. #recoverytwt",Neutral,romanticising anorexia and bulimia giving them cute names like ana and mia makes seem like our should call our eds and pretend old ugly man who fact want feel okay and
458,Exercise bulimia hitting hard rn,Negative,exercise bulimia hitting hard
459,no months start with b wtf. Bulimia when,Neutral,months start with bulimia when
460,bulimia  heaven,Neutral,bulimia heaven
461,"ive never understood people w bulimia who like, look forward to b/ping. and i dont say that to be derogatory AT ALL like it’s literally a mental illness but idk ive just never felt that way??",Neutral,ive never understood people bulimia who look forward and dont say that derogatory all like literally mental illness but idk ive just never felt that
462,im so disgusted i cant fucking escape bulimia i feel like such a loser,Negative,disgusted cant fucking escape bulimia feel like such loser
463,"I’m just gonna say, as a bulimic of 6 years I’ve said “bulimia doesn’t work” or “bulimia is a scam” so many times bc when I developed it I thought i would lose weight but instead I’ve gained or maintained. I wish I knew it wouldn’t before I started so I understand asking🤷🏻",Neutral,just gonna bulimic years said many times when developed thought would lose weight but instead gained wish knew before started understand
464,i know it’s insanely fucked up to compare eds but i genuinely wish i was orthorexic (or even anorexic) sometimes because bulimia just makes me feel so disgusted with myself. idk. i wish i could restrict instead of inhaling the entire fucking pantry at every minor inconvenience yk,Neutral,know insanely fucked compare eds but genuinely wish was orthorexic even sometimes because bulimia just makes feel disgusted with wish could restrict instead inhaling the entire fucking pantry every minor inconvenience
465,My bulimia has never been worse,Negative,bulimia has never been worse
466,Depression makes me transition into bulimia I DID NOT SIGN UP FOR THIS,Negative,depression makes transition into bulimia did not sign for this
467,"my main strategy to stop bulimia relapses is repeat to myself, “i’d rather be fat than internally damaged.” it’s the most effective thing i’ve come up with.",Neutral,main strategy stop bulimia relapses repeat rather fat than internally the most effective thing come
468,"i feel like what makes recovery or special days so much harder w bulimia is thats theres no winning, ‘eat what u want enjoy urself!!’ but ure just binging or hold urself back nd now ure restricting, ‘just dont purge!’ and ure stuck swallowing throwup that wont stay down all night",Negative,feel like what makes recovery special days much harder bulimia thats theres what want enjoy but ure just binging hold urself back now ure dont and ure stuck swallowing throwup that wont stay down all night
469,not ana face not bulimia face but a secret third thing,Neutral,not ana face not bulimia face but secret third thing
470,whoever hacked me and made me have to change my password: I hoped u enjoyed reading my messages about my bulimia,Negative,whoever hacked and made have change hoped enjoyed reading messages about bulimia
471,Kate has bulimia she is not okay.,Negative,kate has bulimia she not
472,bulive bulaugh bulimia,Neutral,bulive bulaugh bulimia
473,"I am so angry with the amount of people who have mental illnesses themselves but judge others with symptoms different to them, ones that aren’t often talked about, like eating your own vomit in bulimia or intrusive sexual thoughts in ocd or thoughts to kill someone in psychosis",Negative,angry with the amount people who have mental illnesses themselves but judge others with symptoms different ones that often talked like eating your own vomit bulimia intrusive sexual thoughts ocd thoughts kill someone psychosis
474,friendship ended with bulimia now anorexia is my best friend,Negative,friendship ended with bulimia now anorexia best friend
475,throwback 2 my school project lastyear during the eating disorder unit,Neutral,throwback school project lastyear during the eating disorder unit
476,I’m a loser of everything but weight,Negative,loser everything but weight
477,Been thinking a lot this evening about why clinicians stop supporting people and why they advocate that people with eating disorders are untreatable.. so my question to you! Why do you think people working in eating disorders so often dismiss people from treatment!?,Neutral,been thinking lot this evening about why clinicians stop supporting people and why they advocate that people with eating disorders are question why you think people working eating disorders often dismiss people from
478,There is no such thing as TOO complex in mental illness. Nobody should be written off because their illness is difficult to treat,Neutral,there such thing too complex mental nobody should written off because their illness difficult treat
479,"Friendly reminder BED is an eating disorder too & bingeing and restricting are commonly comorbid behaviors.
I’m just done w the gatekeeping. The audacity of some ppl to try & decide whether others are disordered enough to be here. We don’t know people’s actual lives. Sit down.",Neutral,friendly reminder bed eating disorder too bingeing and restricting are commonly comorbid just done the the audacity some ppl try decide whether others are disordered enough know actual sit
480,local recovering anorexic takes on the chicken tendy tower,Neutral,local recovering anorexic takes the chicken tendy tower
481,I worked with anorexics for a bit. This is as close to death as I've ever seen anyone. My guess would be that she is out of bed for minutes a day.,Neutral,worked with anorexics for this close death ever seen guess would that she out bed for minutes
482,"im sorry but every time certain people get ahold of something yall make it this. at no point was ‘girl math’ about being stupid, ‘girl dinner’ wasnt about being anorexic…. and also misogynists think we’re stupid anyway",Neutral,sorry but every time certain people get ahold something yall make point was about being wasnt about being and also misogynists think stupid anyway
483,imagine being 105 poiunds and claling urself anorexic /self,Negative,imagine being 105 poiunds and claling urself anorexic
484,"""Guys does my meals look anorexic? 🥺""
WHO EATS THOSE THINGS TOGETHER TF",Negative,does meals look who eats those things together
485,I kinda wish I could be the stereotypical anorexic who’s scared of food,Neutral,kinda wish could the stereotypical anorexic scared food
486,I am literally worst anorexic everyone else eats less or is skinnier and I am greedy and barely manage to lose weight anymore,Negative,literally worst anorexic everyone else eats less skinnier and greedy and barely manage lose weight anymore
487,"pulling hate comments but if we put some for jennifer getting whacked with millions of likes and chinsé being a drvg addict causing her to be anorexic y'all gonna cry?

All of them getting hate comments but guess who's still famous and relevant? Not Rosé for sure.",Neutral,pulling hate comments but put some for jennifer getting whacked with millions likes and chinsé being drvg addict causing her anorexic gonna all them getting hate comments but guess still famous and not rosé for
488,“is my baby anorexic?” LMAOOOOOO,Negative,baby lmaoooooo
489,i haven’t eaten all day wtf i’m so anorexic,Negative,eaten all day wtf anorexic
490,how can you as a gymbro be mean to anorexics mf thats your cousin ?,Negative,how can you gymbro mean anorexics thats your cousin
491,"yes , i’m anorexic !
yes , i gained weight !
we exist !

and i’m not handling it well !",Neutral,yes anorexic yes gained weight exist and not handling well
492,WHY CANT I JUST BE ANOREXIC?? why do i have to suffer w ednos??,Negative,why cant just why have suffer
493,I’m so good at this anorexic shit I’m even touch starved,Neutral,good this anorexic shit even touch starved
494,People when anorexics actually have disordered thoughts,Neutral,people when anorexics actually have disordered thoughts
495,Cause im anorexic next question ?,Neutral,cause anorexic next question
496,She been anorexic since 2008 at that point I just gotta respect it,Negative,she been anorexic since 2008 that point just gotta respect
497,"we can dress up as chefs for halloween since
 “anorexics are scared of food”",Negative,can dress chefs for halloween since are scared
498,do any other high functioning anorexics feel guilty/not sick enough because of it?😕,Neutral,any other high functioning anorexics feel sick enough because
499,"does anyone know what the term is for october (e.g. anorexic august, skinny/starving september, etc.)",Neutral,does anyone know what the term for october anorexic
500,I can't wait for people to look at me and immediately know I'm anorexic,Negative,wait for people look and immediately know anorexic
501,bulimics need to start doing their usernames like the anorexics do except replace “rexia” with “limic”,Negative,bulimics need start doing their usernames like the anorexics except replace with
502,Why are so many edtwt girls fat like you’re not anorexic you’re just on a well needed diet…,Negative,why are many edtwt girls fat like not anorexic just well needed
503,the poorly dressed anorexics are so mad at me,Negative,the poorly dressed anorexics are mad
504,do non disordered ppl not know the difference between anemia and anorexic cause …,Neutral,non disordered ppl not know the difference between anemia and anorexic cause
505,"There are two types of anorexics:
“I will kill myself if I know how much I weigh”
“I will kill myself if I don’t know how much I weigh”",Neutral,there are two types will kill myself know how much will kill myself know how much
506,Pov: this was written by an anorexic,Negative,this was written anorexic
507,please… how do u go from skinny fat rotting in bed anorexic to pilates princess snatched waist queenie anorexic because,Negative,how from skinny fat rotting bed anorexic pilates princess snatched waist queenie anorexic because
508,I’m actually edtwt’s laziest anorexic,Neutral,actually laziest anorexic
509,I’m so tired of seeing kids on here telling ADULTS who work or study or walk a lot that restricting at 500-1000 isn’t “anorexic enough” like jesus christ u fucking maggot not all of us sit in bed 24/7 and rot 😭😭😭 idk bitch stay pressed w ur half a boiled egg white,Negative,tired seeing kids here telling adults who work study walk lot that restricting like jesus christ fucking maggot not all sit bed and rot idk bitch stay pressed half boiled egg white
510,I have a food addiction with the brain of an anorexic oh my god,Neutral,have food addiction with the brain anorexic god
511,fellow anorexics or people with restrictive eds..how do u deal with mental fatigue..nd physical weakness...pls,Negative,fellow anorexics people with restrictive deal with mental physical
512,pro life but anorexic 💀 the math isn’t mathing,Negative,pro life but anorexic the math mathing
513,i wish i was an anorexic white boy,Neutral,wish was anorexic white boy
514,y'all would short circuit if u realized the vast majority of ed sufferers r not low weight anorexics,Neutral,would short circuit realized the vast majority sufferers not low weight anorexics
515,“anorexics hate food” wrong we actually love it we just hate the fact it has cals ☹️,Negative,hate wrong actually love just hate the fact has cals
516,Anorexics knees after kneeling for two seconds,Negative,anorexics knees after kneeling for two seconds
517,maybe because u can be anorexic at any bmi?!?,Neutral,maybe because can anorexic any
518,anorexic era is sm more fun that binging era im gonna lose 10kg this month fr!!,Negative,anorexic era more fun that binging era gonna lose 10kg this month
519,"am i anorexic ? am i bulimic ? who knows, only ed-nos",Neutral,anorexic bulimic who only
520,thread of my old wieiad tiktoks from when i was a better anorexic,Neutral,thread old wieiad tiktoks from when was better anorexic
521,why do so many ppl pretend they’re anorexic,Neutral,why many ppl pretend anorexic
522,Autistic Bald Anorexic Very Rare Trans Girl Not Tampered With $830.00 or best offer,Negative,autistic bald anorexic very rare trans girl not tampered with best offer
523,when Natalia Kills said “my wallet is anorexic” I felt that,Neutral,when natalia kills said wallet felt that
524,"“You’re fat” 
“Oh you’re not fat, you’re anorexic” 

…come on man if you’re gonna insult me at least be good at it 💀😂",Neutral,not man gonna insult least good
525,I wish I was one of those anorexics who only eats cucumbers and hard boiled egg whites,Negative,wish was one those anorexics who only eats cucumbers and hard boiled egg whites
526,"bodycheck
help a poor anorexic find her ass plz",Negative,bodycheck help poor anorexic find her ass plz
527,Does this look anorexic,Neutral,does this look anorexic
528,"“I’m gonna quote tweet this freakishly anorexic person and tell them that they’re fat and need to lose weight! And I’m not just going to do it once and move on, I’ll keep the trend going for several days! THAT, my friends, is peak humor!”",Negative,gonna quote tweet this freakishly anorexic person and tell them that fat and need lose and not just going once and move keep the trend going for several peak
529,there is no greater bond than that of an anorexic woman and her extremely racist boyfriend,Negative,there greater bond than that anorexic woman and her extremely racist boyfriend
530,When transphobes start in with the whole “we don’t give anorexics liposuction” it just reinforces that they have no clue what they are talking about. And are fundamentally unqualified to be engaging in the conversation. And they think they make a really great point. And it’s,Negative,when transphobes start with the whole give anorexics just reinforces that they have clue what they are talking and are fundamentally unqualified engaging the and they think they make really great and
531,I’m the best anorexic cuz for breakfast lunch and dinner i eat you hoes up,Neutral,the best anorexic cuz for breakfast lunch and dinner eat you hoes
532,why can’t i be anorexic in peace i’ve been forced to be normal weight for over a year now bc of treatment I HATE HOW I LOOK,Negative,why anorexic peace been forced normal weight for over year now treatment hate how look
533,lactose intolerant anorexic bitch eats 1 pint of halo top icecream for breakfast and faces the consequences (gone wrong!!),Neutral,lactose intolerant anorexic bitch eats pint halo top icecream for breakfast and faces the consequences
534,"If a man has a lower percentage of body fat than a man and they lose the same amount of weight, who loses the greatest percentage of body fat?",Neutral,man has lower percentage body fat than man and they lose the same amount who loses the greatest percentage body
535,"If my daughter was in the early months of AN, I can’t imagine the added strain of reading these stories about services giving up on patients. AN is hard enough for families. To feel that nobody cares if your child lives or dies is shattering.",Negative,daughter was the early months imagine the added strain reading these stories about services giving hard enough for feel that nobody cares your child lives dies
536,"This #MentalHealthAwarenessWeek, we wanted to emphasize the substantial psychological effects of an #EatingDisorder. OfteÃ¢â‚¬Â¦",Neutral,this wanted emphasize the substantial psychological effects
537,me going back in time to tell taylor she cant talk about her eating disorder in miss americana cause her insane fans will bring it up at any given moment and wont let us enjoy the 1989tv era in peace,Negative,going back time tell taylor she cant talk about her eating disorder miss americana cause her insane fans will bring any given moment and wont let enjoy the 1989tv era peace
538,Every season of my life is plagued by having a crippling eating disorder like when do I get to win?????,Negative,every season life plagued having crippling eating disorder like when get
539,Kerry Washington Recalls ‘Trying To Destroy’ Herself While Battling An Eating Disorder That Made Her Suicidal,Negative,kerry washington recalls herself while battling eating disorder that made her suicidal
540,living with ur parents who know you have an eating disorder sucks. ive gained 10lbs from living with them again. i literally feel so disgusting. i can feel the fat on myself every time I walk. i know everyone sees it too,Negative,living with parents who know you have eating disorder ive gained 10lbs from living with them literally feel can feel the fat myself every time know everyone sees too
541,In season the 5 reunion of married to medicine they did a poor job of addressing Toya saying she had an eating disorder and that the jokes about her weight were triggering especially Jackie and Heavenly like…,Negative,season the reunion married medicine they did poor job addressing toya saying she had eating disorder and that the jokes about her weight were triggering especially jackie and heavenly
542,"Tw: fatphobia, eating disorder Okay, I get now why I'm feeling so mentally exhausted these days, and yet again it is: my fatphobic family. Their obsession with weight loss is literally in every word they say, all they are doing now is related to that.",Negative,eating disorder get now why feeling mentally exhausted these and yet again fatphobic their obsession with weight loss literally every word they all they are doing now related
543,my body is dying and it’s not because of an eating disorder… embarrassing,Negative,body dying and not because eating embarrassing
544,Can twitter stop giving me eating disorder posts on my tl please and thank you,Negative,can twitter stop giving eating disorder posts please and thank you
545,wait till y'all realize that there are medical reasons why someone would need to know their daily intake besides an eating disorder,Neutral,wait till realize that there are medical reasons why someone would need know their daily intake besides eating disorder
546,If that was her intention that’s messed up 😭 I couldn’t imagine knowing my mom named me after an eating disorder,Negative,that was her intention messed imagine knowing mom named after eating disorder
547,"Recovery from an eating disorder is a journey, but it's a journey worth taking. Hold onto hope, and remember that you have the strength within you to overcome this. You deserve to live a life filled with peace, joy, and self-love. Ã°Å¸â€™â€º",Positive,recovery from eating disorder but journey worth hold onto and remember that you have the strength within you overcome you deserve live life filled with and
548,"i weigh 0.0016oz becuz im just a Bug and im little. Beat that, Anorexics !",Negative,weigh becuz just bug and beat anorexics
549,why cant i be it girl lana del rey pink pilates princess wonyoungism type anorexic i feel so trashy and tired all the time,Negative,why cant girl lana del rey pink pilates princess wonyoungism type anorexic feel trashy and tired all the time
550,wish i was an ortho gym obsessed anorexic instead of this binge-restrict sedentary goblin life 😭,Negative,wish was ortho gym obsessed anorexic instead this sedentary goblin life
551,"anorexics think they’re going to save so much money by restricting but you end up paying for 100 doctor visits , 30 supplements and 20€ on that one overpriced low cal safe food you’re obsessed with",Negative,anorexics think going save much money restricting but you end paying for 100 doctor visits supplements and that one overpriced low cal safe food obsessed with
552,this is such a stereotypically anorexic meal,Negative,this such stereotypically anorexic meal
553,best anorexic??,Neutral,best
554,"hnggggh yes i am anorexic, starver, i’m nauseous from my cerebral cortex to my stomach acid",Negative,hnggggh yes nauseous from cerebral cortex stomach acid
555,fink it's about time we discussed how a major portion of edtwt is just men folk who are there solely to prey on anorexic girls because they're aware they're emotionally and mentally fragile and amenable,Negative,fink about time discussed how major portion edtwt just men folk who are there solely prey anorexic girls because aware emotionally and mentally fragile and amenable
556,Wignats flirt with anorexic teenagers. Groypers mog them. And you wonder why we’re winning 🤣,Negative,wignats flirt with anorexic groypers mog and you wonder why winning
557,Starting to think maaaybe I'm actually an anorexic,Neutral,starting think maaaybe actually anorexic
558,90% of anorexics stop right before they hit their perfect skinny goal weight (i’m in the 10%),Neutral,anorexics stop right before they hit their perfect skinny goal weight the
559,"call me a ""fake anorexic"" but macros>calories in my opinion",Neutral,call but opinion
560,"Explain something to me. I’m bmi 15.5, not anemic, don’t bruise easily, good body temp, and I still have a regular and healthy period. Maybe I’m not anorexic at all.",Neutral,explain something bmi not bruise good body and still have regular and healthy maybe not anorexic
561,MY MOM JUST ASKED IF IM DOING AN “ANOREXIC DIET”,Negative,mom just asked doing
562,im so good at being anorexic i say no to cookies on websites btw,Neutral,good being anorexic say cookies websites btw
563,Right😂😂 then when he realized I was indeed not fat he went straight for the “oh you’re anorexic” like MF PICK ONE💀😂,Negative,then when realized was indeed not fat went straight for the like pick
564,"My friend didn't eat all their rice so I asked if I could eat it cuz I'm still hungry, then my anorexic bmi 25 friend was like ""oh ur bulking??"" So I said ""no?"" And he was like ""but ur eating carbs??"" 🤯",Negative,friend eat all their rice asked could eat cuz still then anorexic bmi friend was like said and was like eating
565,Being anorexic is one thing but posting photos of your progress naked is kinda cray cray,Negative,being anorexic one thing but posting photos your progress naked kinda cray cray
566,That anorexic chick needs to be banned from all social media platforms because it's just uncomfortable to look at her,Negative,that anorexic chick needs banned from all social media platforms because just uncomfortable look her
567,GEEKS DO NOT HAVE PEDIGREES OR PERFECT PUNK ROCK RESUMES OR ANOREXIC MAGAZINES IT SMELLS LIKE GIRL IT SMELLS LIKE GIRL,Neutral,geeks not have pedigrees perfect punk rock resumes anorexic magazines smells like girl smells like girl
568,i hate how low cal stuff have such suspicious names how am I supposed to carry around SKINNY FOREVER BAR 4 CALORIES ONLY FOR ANOREXICS without being sus,Neutral,hate how low cal stuff have such suspicious names how supposed carry around skinny forever bar calories only for anorexics without being sus
569,how am i supposed to be anorexic in these conditions 🙄🙄,Neutral,how supposed anorexic these conditions
570,when did kicking ur kid out for being anorexic become socially acceptable,Negative,when did kicking kid out for being anorexic become socially acceptable
571,i have something not so anorexic to say…,Neutral,have something not anorexic
572,asking all my questions here instead of google bc i want to hear the anorexic angle,Neutral,asking all questions here instead google want hear the anorexic angle
573,hey yall look I drew anorexic dazai<3 (its not the best but I really liked this idea of him using bandages as a waist trainer so yea),Neutral,hey yall look drew anorexic not the best but really liked this idea him using bandages waist trainer
574,"""are u an anorexic who bakes and gives it all to ur family or cooks and gives it all to ur family?"" me at least once a week:",Neutral,anorexic who bakes and gives all family cooks and gives all least once
575,worst anorexic driving to get peanut butter 🔥 no regrets,Neutral,worst anorexic driving get peanut butter regrets
576,Just made a irl anorexic friend i am so happy we can fast together now (^o^),Neutral,just made irl anorexic friend happy can fast together now
577,when the sun officially set down i turned into the best anorexic (gmar chatima tova everyone),Neutral,when the sun officially set down turned into the best anorexic chatima tova
578,The anorexic urge to cook the most delicious meals possible’s,Neutral,the anorexic urge cook the most delicious meals
579,shoutout to all my anorexic chefs making the prettiest low cal meals ever,Neutral,shoutout all anorexic chefs making the prettiest low cal meals ever
580,No Anorexic is denying a cucumber this is unrealistic.,Neutral,anorexic denying cucumber this
581,anorexic party starter pack,Neutral,anorexic party starter pack
