,Tweet Body ,Sentiment ,processed_content
703,The masculine urge to maintain and do body recomp instead of becoming severely underweight ,Neutral,the masculine urge maintain and body recomp instead becoming severely underweight
704,Traded my underweight body and thigh gap for 30 extra pounds of muscle and a pretty sweet six pack. My thighs touch now. They can also crush watermelons. I’m not mad about it.,Positive,traded underweight body and thigh gap for extra pounds muscle and pretty sweet six thighs touch they can also crush not mad about
705,i need to be underweight NOW,Negative,need underweight now
706,Dude getting sick while being super underweight is so awful everytime i swear im gonna die i get so weak n feels like my my organs failing heart struggles (=m=) Swear cold i have rn i gonna kill me,Negative,dude getting sick while being super underweight awful everytime swear gonna die get weak feels like organs failing heart struggles swear cold have gonna kill
707,i hope im dangerously underweight by my next physical.,Negative,hope dangerously underweight next
708,"TW WEIGHT AND BMI MENTION 
this is so cute and it helps me want to gain weight bc wdym ideal? u mean perfect? i will be perfect when i gain weight? yes i will!",Positive,weight and bmi mention this cute and helps want gain weight wdym mean will perfect when gain yes
709,Guess my bmi without looking my bio I think I have potential to look thinner,Negative,guess bmi without looking bio think have potential look thinner
710,i used to think disordered people calling themselves fat while being underweight was just them looking for validation and being pick mes but now i get it. i wanted to apologize for the way i was thinking ,Positive,used think disordered people calling themselves fat while being underweight was just them looking for validation and being pick mes but now get wanted apologize for the way was thinking
711,idk how people can go from a high weight to underweight and be fatphobic literally all its proved to me is that the way youre treated when youre fat vs when youre skinny is drastically different,Neutral,idk how people can from high weight underweight and fatphobic literally all its proved that the way youre treated when youre fat when youre skinny drastically different
712,I feel like a fake. I’m not underweight yet and I just feel like I’m doing it for attention I just want to be skinny.,Negative,feel like not underweight yet and just feel like doing for attention just want
713,underweight face vs overweight face who’s winning ?,Negative,underweight face overweight face winning
714,has the diagnostic criteria for ana changed in recent yrs bc i keep seeing ppl with it in their bios alongside “bmi 23” or similar & im confused atp bc i thought being “severely underweight” was part of the diagnostic criteria but idk if its become less rigid & im just dumb,Negative,has the diagnostic criteria for ana changed recent yrs keep seeing ppl with their bios alongside similar confused atp thought being was part the diagnostic criteria but idk its become less rigid just dumb
715,sometimes i don’t even know if i’m disordered cause i don’t even wanna be severely underweight. i just wanna be thin and pretty,Negative,sometimes even know disordered cause even wanna severely just wanna thin and pretty
716,i’ve always been a normal weight. i’ve never been overweight or underweight in my whole life. i’m the most boring person alive (◞‸◟),Negative,always been normal never been overweight underweight whole the most boring person alive
717,im too fat to have this many moots i need to lock myself in a dungeon and get out when im bmi 14,Negative,too fat have this many moots need lock myself dungeon and get out when bmi
718,seeing someone with a higher bmi than u looking smaller will actually ruin ur whole day like…..,Negative,seeing someone with higher bmi than looking smaller will actually ruin whole day
719,Being overweight is disgusting,Negative,being overweight disgusting
720,This is crazy coming from you since Kevin Samuels literally made videos talking about his disdain for overweight dark skin BW such as yourself. Kevin Samuels literally said DSBW like YOU are scientifically unattractive and beneath all other races of women. Yet you worship him 😭,Neutral,this crazy coming from you since kevin samuels literally made videos talking about his disdain for overweight dark skin such kevin samuels literally said dsbw like you are scientifically unattractive and beneath all other races yet you worship him
721,Woke up NORMAL instead of overweight today im so proud and relieved!!!!! ,Positive,woke normal instead overweight today proud and
722,I'm glad Trump is a geriatric who is 100 lbs overweight and eats a ton of junk food and is under an incredible amount of stress and must have terribly high blood pressure. Tick tock.,Negative,glad trump geriatric who 100 lbs overweight and eats ton junk food and under incredible amount stress and must have terribly high blood tick
723,"Isn’t it kinda weird that according to BMI, I’m still clinically overweight? 

I wear a goddamn size medium.",Neutral,kinda weird that according still clinically wear goddamn size
724,my bmi is almost overweight but i look so good tbh the bmi scale is for ppl with bad fat distribution not for everyone,Neutral,bmi almost overweight but look good tbh the bmi scale for ppl with bad fat distribution not for everyone
725,This can’t be real this cannot be real I’m finally overweight,Negative,this real this cannot real finally overweight
726,"✨IT’S A SWIMSUIT!✨
Don’t try to tell me that I’m not overweight. I am. I know from the front it doesn’t look as bad, but I am.
I’m not cleared to exercise right now due to my back sprain… I’m just really struggling with my body cuz there’s nothing I can do about it right now.",Neutral,try tell that not know from the front look but not cleared exercise right now due back just really struggling with body cuz nothing can about right
727,we dont judge overweight bmis over here go back to mpa with tht bs,Neutral,dont judge overweight bmis over here back mpa with tht
728,hi im overweight and female are there any takers,Neutral,overweight and female are there any takers
729,The only “good” thing about me being overweight is that I can lose weight quicker but won’t see a fucking difference after a 10lb weight lose….,Neutral,the only thing about being overweight that can lose weight quicker but see fucking difference after 10lb weight
730,Me 5 minutes after crying about being overweight & saying. I'm going on a diet...,Negative,minutes after crying about being overweight going
731,But indeed your love for duniya should not overweight your love for Allah.,Neutral,but indeed your love for duniya should not overweight your love for
732,being beautifully thin is more advanced than being trapped in a medically overweight anatomy,Negative,being beautifully thin more advanced than being trapped medically overweight anatomy
733,"I don't really know where this obsession with huge thighs & boobs come from when searching for partners it's good for sex, yeah, but I genuinely don't care about these things as long as they have a pretty face and aren't overweight",Neutral,really know where this obsession with huge thighs boobs come from when searching for partners good for but genuinely care about these things long they have pretty face and overweight
734,i never eat but im so overweight ,Negative,never eat but overweight
735,STARTED FROM THE BOTTOM NOW WE HERE AS OF TODAY I AM OFFICIALLY NO LONGER OVERWEIGHT!!!!!!,Positive,started from the bottom now here today officially longer
736,a month… is there even a dif .  pls do not be rude i know i’m overweight but LMAO reveal ig,Neutral,there even dif pls not rude know overweight but lmao reveal
737,Overweight retards when they can’t make the same unfunny rape joke again,Negative,overweight retards when they make the same unfunny rape joke again
738,"More on the metal rant, I don't like people who say they want a metalhead bf but they don't mean greasey old men who are overweight and silly, or hell they think being metal is some kind of fashion and not music based",Negative,more the metal like people who say they want metalhead but they mean greasey old men who are overweight and hell they think being metal some kind fashion and not music based
739,"i’ve been overweight all my life, so best believe once i’m finally skinny imma act a fool ",Positive,been overweight all best believe once finally skinny imma act fool
740,hiii can i be your overweight customer that puts you outta business,Neutral,hiii can your overweight customer that puts you outta business
741,One thing is for certain being overweight ages me,Neutral,one thing for certain being overweight ages
742,"I met an autistic gentleman who was around 5'7, overweight, neck beard, wearing a wolf shirt, spoke in various cartoon character voices and smelled like cheese. He had a wife, also autistic, that adored him and thought he was the funniest man on the planet.

Checkmate incels",Positive,met autistic gentleman who was around neck wearing wolf spoke various cartoon character voices and smelled like had also that adored him and thought was the funniest man the checkmate incels
743,my parents are the reason that ive been overweight my entire life,Negative,parents are the reason that ive been overweight entire life
744,Insults aside I think part of the reason girls turn to transition is because they’re overweight and/or not the ideal body type. I was overweight and thought top surgery might fix it or motivate me to lose.,Negative,insults aside think part the reason girls turn transition because overweight not the ideal body was overweight and thought top surgery might fix motivate
745,"Carry yourself with the confidence of an overweight girl in tight clothing who calls herself ""thick"".",Positive,carry yourself with the confidence overweight girl tight clothing who calls herself
746,"In my experience, people who used to be overweight are especially prone to slip into low key fat shaming out of sincere concern for other people.",Negative,people who used overweight are especially prone slip into low key fat shaming out sincere concern for other
747,working out if the number in their bio is their age or bmi,Neutral,working out the number their bio their age bmi
748,i miss being BMI 16.0 and worst thing is the only pic i have of it is this,Negative,miss being bmi and worst thing the only pic have this
749,i am working on the bmi 10 thread who want a tag for it,Negative,working the bmi thread who want tag for
750,i wish my bmi 21 could look as good as David tennant at bmi 21,Negative,wish bmi could look good david tennant bmi
751,"just bc people aren't bmi 13 doesn't mean they are ""fat"" 😭💀",Neutral,just people bmi mean they are
752,what bmi is this? i think this is the most realistic goal 4 me,Neutral,what bmi think this the most realistic goal
753,Tw//bodycheck Idk my current bmi but all I can see is bmi 21 (my hw) and I want to rip my thigh fat off going hard at the gym today.,Negative,idk current bmi but all can see bmi and want rip thigh fat off going hard the gym
754,BMI high 18’s but yet I feel so big,Neutral,bmi high but yet feel big
755,"My bmi was 38. I've lost 3 and a half stone in 4 months using #semaglutide. No side effects. It's changed my life.
#thetruthabouttheskinnyjab #ozempic",Positive,bmi was lost and half stone months using side changed
756,what bmi do my legs look.. ik they aren’t flat on anything bht still,Neutral,what bmi legs they flat anything bht still
757,having a sister that doesn't believe underweight ppl can have body dysmorphia or eds is definitely not fun,Negative,having sister that believe underweight ppl can have body dysmorphia eds definitely not fun
758,i either want to be deathspo and maintain or recovered and fitspo. no middle ground. i hated when i was recovering and was a weird in the middle but i felt so uncomfortable i was still mentally ill but physically stable but slightly underweight and needing to gain more it was ugh,Neutral,either want deathspo and maintain recovered and middle hated when was recovering and was weird the middle but felt uncomfortable was still mentally ill but physically stable but slightly underweight and needing gain more was ugh
759,guys i thought under bmi 17.5 was underweight……. why do some ppl thinks it’s under 18.5 ?????,Neutral,guys thought under bmi was why some ppl thinks under
760,sometimes i forget bmi 16 is actually skinny and most people don’t think i’m fat,Neutral,sometimes forget bmi actually skinny and most people think fat
761,Goat at being near underweight😞[smoking cig anime girl],Negative,goat being near cig anime
762,if severely underweight ppl w eds are forced into ip and made to gain weight why arent severely obese people forced into treatment and made to lose weight? is it not the same thing of both being seriously unhealthy and sometimes fatal? /genq,Positive,severely underweight ppl eds are forced into and made gain weight why arent severely obese people forced into treatment and made lose not the same thing both being seriously unhealthy and sometimes
763,my doc just told me im underweight idk how to react to this like,Neutral,doc just told underweight idk how react this like
764,"thread of some of my wieiad tiktoks when i was maintains bmi 13s just warning you it’s v repetitive and my camera skills were questionable (ps ignore my tiktok username, i don’t use the acc anymore) also i think you guys got way too excited for this i’m sorry haha",Neutral,thread some wieiad tiktoks when was maintains bmi 13s just warning you repetitive and camera skills were questionable ignore tiktok use the acc also think you guys got way too excited for this sorry haha
765,"""bmi 20s"" is it 21 or 27",Neutral,
766,"Fasting seems great and can be. But if you're starting at a higher weight, it won't be as effective for losing. When you're underweight, it's more effective.  #anacoach #edtwt",Neutral,fasting seems great and can but starting higher effective for when more
767,is it possible for the doctors to force you to gain weight if you are not underweight but have malnutrition symptoms like menstruation loss,Neutral,possible for the doctors force you gain weight you are not underweight but have malnutrition symptoms like menstruation loss
768,am i even disordered if i'm closer to overweight than to underweight,Neutral,even disordered closer overweight than underweight
769,"If he's 179cm and 54kg, isn't that underweight? Some people do go crazy because they don't eat",Negative,179cm and that some people crazy because they eat
770,my dad keeps telling me i need to gain weight i’m not even underweight??,Neutral,dad keeps telling need gain weight not even
771,when will people i know irl start asking me if im okay because i look underweight ,Neutral,when will people know irl start asking okay because look underweight
772,No because wdym I’m underweight but there’s still fat on my thighs?,Neutral,because wdym underweight but still fat
773,Also guys when I told my friends about how I purge and starve my friend with anorexia said that I don’t have a ed cause I’m not underweight :( I never talk about my ed ever again. Btw she is bmi 16 (37kg),Negative,also guys when told friends about how purge and starve friend with anorexia said that have cause not underweight never talk about ever btw she bmi
774,need to be underweight by christmas,Negative,need underweight christmas
775,I’m being forced into recovery because I’m 30 pounds underweight and I might die from a heart attack…. does anyone have any tips for how to hide food,Negative,being forced into recovery because pounds underweight and might die from heart does anyone have any tips for how hide food
776,"hey so i’m finally ready to get back on here, read my previous little rant thread if you need more deets 🫶🏼 anyways i finally fit into a size XS jeans and got into the cusp of the underweight category",Neutral,hey finally ready get back read previous little rant thread you need more deets anyways finally fit into size jeans and got into the cusp the underweight category
777,Moderately underweight 8ut its only cause im tall i dont look it i dont think,Neutral,moderately underweight 8ut its only cause tall dont look dont think
778,"you know what makes me mad? the fact that i was literally born to always be tall and skinny. i used to have a really fast metabolism, i could literally eat whatever i wanted and not gain weight. my set point is underweight. i’m an ectomorph. -",Negative,you know what makes the fact that was literally born always tall and used have really fast could literally eat whatever wanted and not gain set point
779,3 more pounds and im clinically underweight 😭🫶🏻,Negative,more pounds and clinically underweight
780,The fact that ive gone down 4 bmi points and only have 2 more until im underweight is so 😃,Neutral,the fact that ive gone down bmi points and only have more until underweight
781,i swear people in my life just want me to stay fat ? and like i have been actually overweight fat my whole life and im finally losing weight and they don’t even know abt my disordered behaviour to them im just losing weight.. but they’re so mad or worried abt it,Negative,swear people life just want stay fat and like have been actually overweight fat whole life and finally losing weight and they even know abt disordered behaviour them just losing but mad worried abt
782,i think the underweight range should start of bm! 17.5,Neutral,think the underweight range should start
783,mother thinks overweight is healthy ,Negative,mother thinks overweight healthy
784,"its the way people on the internet get bullied and made fun of for being overweight and there are girls posting photos of their obviously size small bodies and referring themselves as fat . i literally cant continue to be here, ya’ll are insane",Negative,its the way people the internet get bullied and made fun for being overweight and there are girls posting photos their obviously size small bodies and referring themselves fat literally cant continue are insane
785,I feel like I'm not underweight enough for people to notice that I am underweight,Neutral,feel like not underweight enough for people notice that underweight
786,is bmi 18.2 a safe place to say i am genuinely just big boned . i never called myself that when i was overweight but now that ive lost enough im like Yeahhh…,Neutral,bmi safe place say genuinely just big boned never called myself that when was overweight but now that ive lost enough like
787,"I'm actually a 56 year old overweight virtually unknown standup comedian operating in the Midwest area bar scene. I go on stage with a fedora hat on and make jokes about my nagging wife who's going through menopause right now, and how I haven't had sex in the last 15 years.",Neutral,actually year old overweight virtually unknown standup comedian operating the midwest area bar stage with fedora hat and make jokes about nagging wife going through menopause right and how had sex the last
788,ppl can still have daddy issues if they still have a dad. ppl can still have mommy issues if they still have a mom. ppl can still have anorexia if they are overweight. ppl can still have depression if they r happy. ppl can still have bpd if they dont split often. ,Neutral,ppl can still have daddy issues they still have ppl can still have mommy issues they still have ppl can still have anorexia they are ppl can still have depression they ppl can still have bpd they dont split
789,"I’ve seen pictures of trump without his makeup. He looks like death warmed over. I wonder how long it takes to put on all that tan paste. Without the makeup he looks like what he is, a fat, overweight, ugly slug.",Negative,seen pictures trump without his looks like death warmed wonder how long takes put all that tan without the makeup looks like what ugly
790,What bmi/weight would I need to look like this being 5’2 if you guys can answer :p,Neutral,what would need look like this being you guys can answer
791,"It's amazing how people here say ""You go girl"" ""So sexy"" ""so hot"" for overweight people....
When in reality friends would say: Gym Gym and Gym",Negative,amazing how people here say for overweight when reality friends would gym gym and gym
792,"To prevent eating disorders, it's important to foster a positive relationship with food and body image. Promote a healthy self-esteem, encourage open conversations about body image and mental health, and educate individuals about the",Positive,prevent eating important foster positive relationship with food and body promote healthy encourage open conversations about body image and mental and educate individuals about the
793,"Lots of people with eating disorders have perfectionist traits which can make recovery feel difficult, as if it doesn’t feel perfect it can feel like it’s not worth doing. But there’s no such thing as a ‘perfect’ recovery, and it’s consistency that really gets positive results.",Positive,lots people with eating disorders have perfectionist traits which can make recovery feel feel perfect can feel like not worth but such thing and consistency that really gets positive
794,"Oftentimes, weight loss due to other reasons (e.g. illness, surgery, mood concerns, the list is endless) is how it starts. In someone with a vulnerable brain for whatever reason (developmentally, genetically, etc), that weight loss triggers #eatingdisorder behaviors.",Negative,weight loss due other reasons mood the list how someone with vulnerable brain for whatever reason that weight loss triggers
795,"In the United States, 28.8 million Americans will suffer from an eating disorder at some point in their lives. NEDA is the largest nonprofit organization dedicated to supporting individuals and families affected by eating disorders. #ElevateTheConvo",Positive,the united million americans will suffer from eating disorder some point their neda the largest nonprofit organization dedicated supporting individuals and families affected eating
796,"RT @PreventionUtd: Body dissatisfaction can have a serious impact on all aspects of a personÃ¢â‚¬â„¢s life, including physical and mental health.Ã¢â‚¬Â¦",Negative,body dissatisfaction can have serious impact all aspects including physical and mental
797,Selfies of me while I’m 30 pounds overweight,Negative,selfies while pounds overweight
798,triggering myself by making my sim slowly lose weight and get skinny (shes overweight) because she doesnt eat much shes mostly on her pc or doing drugs and doesnt eat unless shes hungry af most of the time AUTONOMOUSLY ASWELL I AINT MAKING HER STARVE,Negative,triggering myself making sim slowly lose weight and get skinny because she doesnt eat much shes mostly her doing drugs and doesnt eat unless shes hungry most the time autonomously aswell aint making her starve
799,Why I am still eating if I am almost overweight?,Negative,why still eating almost
800,yes bmi 17 is like barely underweight but irl everyone thinks ur crazy skinny,Negative,yes bmi like barely underweight but irl everyone thinks crazy skinny
801,I don't want to be underweight but i also do want to be underweight but also i want to be but i but then i also but,Negative,want underweight but also want underweight but also want but but then also but
802,"Just weighed myself, still underweight👍🏻",Neutral,just weighed still
803,how are people even overweight do you eat THAT MUCH,Negative,how are people even overweight you eat that much
804,i was almost overweight and now i'm getting closer to being underweight i sometimes still can't believe i really lost the weight,Neutral,was almost overweight and now getting closer being underweight sometimes still believe really lost the weight
805,i think my reward for reaching 105lbs (bmi 16.9 qualifying me as severely underweight and meeting the bmi requirements for anorexia nervosa) is gonna be an apple watch Is it worth it,Negative,think reward for reaching 105lbs qualifying severely underweight and meeting the bmi requirements for anorexia gonna apple watch worth
806,laughing but then remembering I'll never truly be happy unless I'm severely underweight or dead so nothings actually funny,Negative,laughing but then remembering never truly happy unless severely underweight dead nothings actually funny
807,"My legs are so faaaaat👹, I'm almost underweight tho😘👍",Negative,legs are almost underweight
808,i hate pe class now i want to prove that im underweight,Negative,hate class now want prove that underweight
809,Im underweight and my period is gone i feel a little validated in my ed finally (?),Negative,underweight and period gone feel little validated finally
810,Being high and underweight is kinda scary bc my heart races from being high and I get scared ts catching up to me💀💀💀,Negative,being high and underweight kinda scary heart races from being high and get scared catching
811,🛑🛑🛑moots this is really urgent if u know any doctor can u ask them if 36 heart rate fatal for an anorexic or underweight girly😭 it's been a week n my bpm is getting lower,Positive,this really urgent know any doctor can ask them heart rate fatal for anorexic underweight been week bpm getting lower
812,i refuse to believe i look underweight my body looks like layers of fat everywhere,Neutral,refuse believe look underweight body looks like layers fat everywhere
813,oh to be tastefully underweight,Neutral,tastefully underweight
814,"it’s not even october and i’m not even underweight why the fuck am i SO
COLD THIS IS HELLISH",Negative,not even october and not even underweight why the fuck cold this hellish
