,Tweet Body ,Sentiment ,processed_content
0,sorry i didn’t respond for 2 weeks i was focused on my eating disorder,Neutral,sorry respond for weeks was focused eating disorder
1,"only i can have an eating disorder, everyone else deserves to eat🙄",Negative,only can have eating everyone else deserves
2,having an eating disorder isn’t an excuse to be stupid,Negative,having eating disorder excuse stupid
3,everybody been telling me i’m getting to be an unhealthy skinny 🫤 like is that true?? i’m too skinny or sum?? cause they callin me anorexic,Neutral,everybody been telling getting unhealthy skinny like that too skinny cause they callin anorexic
4,"I am very thin (people think I am anorexic). When I was a child, I thought everyone viewed through the lens of my skinniness. And while I was occasionally bullied, I stopped interpreting others' actions as being insulting when I became comfortable with myself.",Negative,very thin think when was thought everyone viewed through the lens and while was occasionally stopped interpreting actions being insulting when became comfortable with
5,When did body positivity turn into making fun of people with eating disorders?,Negative,when did body positivity turn into making fun people with eating
6,calling myself Anorexic still feels like such a lie even though no other word would fit better it just feels so harsh. like i eat sometimes. i cant be anorexic. i dont always struggle as much with eating. im not anorexic. sometimes i can eat like normal. i do not have anorexia,Neutral,calling myself anorexic still feels like such lie even though other word would fit better just feels like eat cant dont always struggle much with not sometimes can eat like not have anorexia
7,"before i was disordered i bought a dozen of these and hid them from my family and ate them in 2 days. i miss this so, so so bad.",Neutral,before was disordered bought dozen these and hid them from family and ate them miss this
8,"“Fuck this eating disorder, I can eat whatever I want”",Neutral,this eating can eat whatever
9,i still had a eating disorder here but it was not as bad as it is now i was still more happy then,Neutral,still had eating disorder here but was not bad now was still more happy then
10,cant wait to start my anorexia diet 😍,Positive,cant wait start anorexia diet
11,You are the best anorexic.,Positive,you are the best
12,"I didn’t write it. But if you want, I’ll fight whoever did. Keep in mind that I can’t swallow food and have a serious back problem and thus have no physical strength.",Neutral,write but you fight whoever keep mind that swallow food and have serious back problem and thus have physical
13,I’ve been binge eating this week since I got severely dehydrated I need to turn this around  ,Negative,been binge eating this week since got severely dehydrated need turn this around
14,I just found out that years ago a family took their anorexic daughter to court for refusing to eat??? That is wild,Negative,just found out that years ago family took their anorexic daughter court for refusing that wild
15,no eating disorder shit how can I gain 15 lbs ever since I turned fifteen,Neutral,eating disorder shit how can gain lbs ever since turned fifteen
16,You know he has Ed and (me : eating disorder) no  erectial disfunction,Neutral,you know has and eating erectial disfunction
17,my eating disorder is ruining my life lol,Negative,eating disorder ruining life lol
18,i went to the doctors for my depression and now i’m being sent to the eating disorder service :/ gotta go for an assessment on friday,Negative,went the doctors for depression and now being sent the eating disorder service gotta for assessment friday
19,Having an eating disorder and having a friend who wants to lose weight is the most frightening thing ever. I feel like anything I say could put them in a dangerous place,Neutral,having eating disorder and having friend who wants lose weight the most frightening thing feel like anything say could put them dangerous place
20,i have to admit i do not know what i’m doing anymore eating disorder wise like u guys have evolved so much. i’m sticking to my methods. the beautiful methods that allowed me to stay just on the border of underweight through 7 years of starving myself because fuck my life right,Negative,have admit not know what doing anymore eating disorder wise like guys have evolved sticking the beautiful methods that allowed stay just the border underweight through years starving myself because fuck life right
21,They say abs are made in the kitchen. Sugar is a problem for me  I can’t even have junk food in my house or I’m gonna eat it.,Neutral,they say abs are made the sugar problem for even have junk food house gonna eat
22,I was so hungry today from waiting so late to eat lunch that I almost passed out…and I was shaking. How was I ever anorexic. Like seriously?,Neutral,was hungry today from waiting late eat lunch that almost passed was how was ever like
23,"If so, what exactly is the problem? What if he ordered McDonald’s or a dinner from the chef? It would be obvious that no one who didn’t have the security clearance could be in the room for the food delivery. I don’t see this as a problem or an issue at all. #KAG2020",Neutral,what exactly the what ordered dinner from the would obvious that one who have the security clearance could the room for the food see this problem issue
24,My anorexia,Positive,anorexia
25,"But anyways, the problem is, I looked at the big thing, and really it wasn't that big, and I just couldn't do it. So I did all the small things on my to do list. Ordered pet food. Created that webpage (that's easy for me, I realize it isn't easy for others), other things.",Neutral,but the problem looked the big and really that and just did all the small things ordered pet created that webpage easy for realize easy for other
26,"Pl. do not expect press& Politicians to educate public on Diet/food items that protect Health as they want some problem or other all the times to make their presence. The importance& medicinal value of seasonal food items, habits etc. are to be passed on from Parents to children.",Neutral,not expect politicians educate public items that protect health they want some problem other all the times make their the medicinal value seasonal food habits are passed from parents
27,everyone keeps asking me if ive eaten like yall 😭 ive had a binge eating disorder since kindergarten trust me ive EATEN,Neutral,everyone keeps asking ive eaten like yall ive had binge eating disorder since kindergarten trust ive eaten
28,Back to my eating disorder shit,Neutral,back eating disorder shit
29,favorite part about my eating disorder (arfid) is that i can eat 3 meals a day for less than $15 bc i simply eat a small amount of the same thing for all 3 💀,Neutral,favorite part about eating disorder that can eat meals day for less than simply eat small amount the same thing for all
30,i just ate pizza i am the worst anorexic,Negative,just ate pizza the worst anorexic
31,"My goal this month is to be KINDER to myself. When depressed I either go long days w out eating then binge eat, or I drink more than I should,&then put myself down for my bodies reactions. I want to love each version of myself more and more everyday and treat her kindly.",Positive,goal this month kinder when depressed either long days out eating then binge drink more than put myself down for bodies want love each version myself more and more everyday and treat her
32,"I fight the anorexic thoughts as hard as I can and eat to be able to keep my apartment, to have the energy to give Ollie dog the best life full of long walks, I have energy to live, to travel to meet my friends and make memories to cherish. To live a life.",Positive,fight the anorexic thoughts hard can and eat able keep have the energy give ollie dog the best life full long have energy travel meet friends and make memories live
33,"I dont understand. Is there a problem with ketchup on hotdogs? ALSO, why do people feel entitled to tell others how to eat their food? Im gonna go eat a ketchup steak now just because I can.",Neutral,dont there problem with ketchup why people feel entitled tell others how eat their gonna eat ketchup steak now just because
34,ok at this point i have binge eating disprder maybe fasting is just the way to go ill just fast for days and then try to restrict ,Negative,this point have binge eating disprder maybe fasting just the way ill just fast for days and then try restrict
35,"I struggled with anorexia for a decade. I still have days where I feel not good enough. ED is real and mostly impacts women. It's the deadliest mental disorder. It is being buried by gender dysphoria because it's inconvenient: media can induce dysphoria, it's not a natural state.",Neutral,struggled with anorexia for still have days where feel not good real and mostly impacts the deadliest mental being buried gender dysphoria because media can induce not natural
36,"Family-based treatment strategies for managing school lunches, based on ""When Your Teen Has an Eating Disorder,"" by Dr. Muhlheim, PsyD",Neutral,treatment strategies for managing school based your teen has eating psyd
37,Is Greta anorexic? She incredibly thin.,Neutral,greta she incredibly
38,Orthorexics and/or anorexic in denial usually take magnesium supplement for its laxative effect. So yeah hmmm,Negative,orthorexics anorexic denial usually take magnesium supplement for its laxative yeah hmmm
39,i honestly may be the worst anorexic but i rlly wanna do good this month i love the cold it makes me feel so good and my new cool clothes r coming in soon nd i wanna fit into that skirt so bad,Neutral,honestly may the worst anorexic but rlly wanna good this month love the cold makes feel good and new cool clothes coming soon wanna fit into that skirt bad
40,this is so unhealthy please stop promoting anorexia and focusing on weight,Negative,this unhealthy please stop promoting anorexia and focusing weight
41,These the same niggas and bitches that be raving about how great strip club food is now niggas got a problem with twerking at the dinner table 🙄,Neutral,these the same niggas and bitches that raving about how great strip club food now niggas got problem with twerking the dinner table
42,"Anorexia is the norm for us...  Not, the exception…",Negative,anorexia the norm for the
43,"Thank you to the creators of #resettingfood for a powerful, thought provoking conversation with so many voices across the globe bringing their unique and valuable perspectives. As was said, “together we’ve already started to fix them [the food problem]. Let’s make the future work",Neutral,thank you the creators for thought provoking conversation with many voices across the globe bringing their unique and valuable was already started fix them food make the future work
44,My problem is I be expecting food to just appear in the morning ,Neutral,problem expecting food just appear the morning
45,"""While eating disorders have increased by more than 50 per cent among females during the pandemic, experts say the difficulties men and boys have speaking about mental health adds to the likelihood many are suffering from the same disorders alone.""",Negative,eating disorders have increased more than per cent among females during the experts say the difficulties men and boys have speaking about mental health adds the likelihood many are suffering from the same disorders
46,bruhhhhhhhhhh cook out is gas 😭 the closest one to me is in 2 hours away. Their platters are so good binge eating on a budget lmfao,Neutral,bruhhhhhhhhhh cook out gas the closest one hours their platters are good binge eating budget lmfao
47,"To prevent eating disorders, it's important to foster a positive relationship with food and body image. Promote a healthy self-esteem, encourage open conversations about body image and mental health, and educate individuals about the",Positive,prevent eating important foster positive relationship with food and body promote healthy encourage open conversations about body image and mental and educate individuals about the
48,People who don’t have eating disorders and actively interact with edtwt are so annoying omg,Negative,people who have eating disorders and actively interact with edtwt are annoying omg
49,what makes u guys think u can make fun of people with eating disorders for no reason,Negative,what makes guys think can make fun people with eating disorders for reason
50,there's one woman who's literally promoting eating disorders on tiktok and acts all innocent abt it ,Negative,one woman literally promoting eating disorders tiktok and acts all innocent abt
51,this aint even edtwt ur talking abt anymore ur just talking about eating disorders in general,Negative,this aint even edtwt talking abt anymore just talking about eating disorders general
52,"""diagnosing"" anyone who's maintaining a healthy diet and working out with eating disorders and claiming that they're torturing themselves for other people's approval is NOT helpful for people with actual eating disorders.",Negative,anyone maintaining healthy diet and working out with eating disorders and claiming that torturing themselves for other approval not helpful for people with actual eating
53,sometimes i think y’all forget people who aren’t active on that side of twitter or social media in general have severe eating disorders too so y’all use that as a way to be overly insensitive. or y’all just don’t care,Negative,sometimes think forget people who active that side twitter social media general have severe eating disorders too use that way overly just care
54,I don't disagree that happens but the problem with pensions at the low rate they are and rents around here being as high as they are some just can't afford food or heat too.,Neutral,disagree that happens but the problem with pensions the low rate they are and rents around here being high they are some just afford food heat
55,my dad suggesting me pizza .. i am anorexic and currently trying to keep my calorie intake under 100 today mind your own business ,Negative,dad suggesting pizza anorexic and currently trying keep calorie intake under 100 today mind your own business
56,A woman tries to balance her relationships with her mother and teenage daughter while under the shadow of #anorexia in the atmospheric British drama #BodyofWater.,Neutral,woman tries balance her relationships with her mother and teenage daughter while under the shadow the atmospheric british drama
57,"Is it just me who eats less then usual and feels sick after eating from skipping meals/not eating any food all day,used to have an eating disorder I've been working on it and its better but I don't know why this is happening. Is it just me or dose this happens to anyone else to?",Neutral,just who eats less then usual and feels sick after eating from skipping eating any food all have eating disorder been working and its better but know why this just dose this happens anyone else
58,We all have bad self image and eating disorders now,Negative,all have bad self image and eating disorders now
59,having an eating disorder while being fat has to be the most embarrassing fact about me,Negative,having eating disorder while being fat has the most embarrassing fact about
60,"This is what a man would do. But, the other gender? They'll start looking for fancy names like ""Hormonal imbalance"", ""PCOS"", ""Eating disorder"" bla bla bla. ",Negative,this what man would the other start looking for fancy names like bla bla
61,eating disorder getting boring as hell why arent i skinny yet erm anyways *binges*,Negative,eating disorder getting boring hell why arent skinny yet erm anyways
62,i be on eating disorder twitter and then i eat,Neutral,eating disorder twitter and then eat
63,"waiting for the day some of begin to comprehend that your eating disorder is in fact capable of killing u, stop acting like you’re gonna hit your ugw and recover unscathed pls do yourself a favor and start researching harm reduction and how u can prevent yourself from dying",Negative,waiting for the day some begin comprehend that your eating disorder fact capable killing stop acting like gonna hit your ugw and recover unscathed pls yourself favor and start researching harm reduction and how can prevent yourself from dying
64,at it's core binge eating disorder is the body's attempt to self soothe and cope so finding a way to soothe yourself and regulate your emotions is the first thing you should do if bingeing is something you struggle with,Neutral,core binge eating disorder the attempt self soothe and cope finding way soothe yourself and regulate your emotions the first thing you should bingeing something you struggle with
65,Pause why are my thighs like the same size as my calves now do they look disproportionate?,Negative,pause why are thighs like the same size calves now they look
66,don’t ruin your progress just to have a couple minutes of satisfaction,Neutral,ruin your progress just have couple minutes satisfaction
67,Every single time I eat,Negative,every single time eat
68,my genius foolproof way of beating the ed allegations! “do you have an eating disorder?” “nuh uh.”,Neutral,genius foolproof way beating the you have eating
69,recovering isn’t enough i need to kill my eating disorder with a mallet,Negative,recovering enough need kill eating disorder with mallet
70,When the eating disorder actually has effects 😱😭🤯,Neutral,when the eating disorder actually has effects
71,haven’t been on this acc in so long but update i got hospitalised due to my binge eating disorder LMAO ate too much my intestines stopped working normally 1/2,Negative,been this acc long but update got hospitalised due binge eating disorder lmao ate too much intestines stopped working normally
72,eating disorder? nahhh im eating dis order ,Negative,eating nahhh eating dis order
73,"even if your eating disorder or anybody else tries to tell you otherwise, the colder months aren’t relapse season. the fall and winter are about creating new memories, buying gifts & decor, trying festive drinks, getting cosy in your softest blankets with your favourite snacks.",Positive,even your eating disorder anybody else tries tell you the colder months relapse the fall and winter are about creating new buying gifts trying festive getting cosy your softest blankets with your favourite
74,The urge to tell everyone about my eating disorder cause I’m sick of them acknowledging my disordered tendencies and not being worried,Neutral,the urge tell everyone about eating disorder cause sick them acknowledging disordered tendencies and not being worried
75,it’s insane how quickly an eating disorder can ruin your life people who don’t have one have NO idea,Negative,insane how quickly eating disorder can ruin your life people who have one have idea
76,eating disorder? nah im just starvemaxxing,Negative,eating nah just starvemaxxing
77,Me when I realize I have an eating disorder,Neutral,when realize have eating disorder
78,My eating disorder when my mom makes my favorite food,Neutral,eating disorder when mom makes favorite food
79,i feel like i’m almost faking anorexia because i don’t fast often,Neutral,feel like almost faking anorexia because fast often
80,Me dying from anorexia:,Negative,dying from
81,Anorexia is like making deals with the devil.. you’ll get what you asked for (skinny) but at the expense of what? And for how long?,Neutral,anorexia like making deals with the get what you asked for but the expense and for how
82,I NEED TO BE AT LEAST 50KG ON OCT... anorexia starts NOW. IM TIRED,Negative,need least 50kg anorexia starts tired
83,"Eating disorders affect YOUR eating patterns, not anyone else’s. Leave other people the fuck alone you creeps💀",Negative,eating disorders affect your eating not anyone leave other people the fuck alone you
84,"People have mental illnesses; they are not their symptoms. I have an #eatingdisorder, anxiety and depression. None of which define me. I’m characterized by the people I love, the life I live, how I treat others, my hate of Scrabble, and how proud I am to be your columnist. #China",Positive,people have mental they are not their have anxiety and none which define characterized the people the life how treat hate and how proud your
85,How do I know if I actually have anorexia or if my brain is just fooling me I feel like I’m not actually anorexic cuz I’m a normal weight and Ik u can still be anorexic even tho ur a normal weight but it makes me feel invalid and like I’m faking it… Help,Neutral,how know actually have anorexia brain just fooling feel like not actually anorexic cuz normal weight and can still anorexic even tho normal weight but makes feel invalid and like faking help
86,the anorexia starts tmrw deadass,Negative,the anorexia starts tmrw deadass
87,my eating disorder leaving my body the minute I became an adult,Negative,eating disorder leaving body the minute became adult
88,HIII MOOTS HRU hows anorexia treating you today,Negative,hiii moots hru hows anorexia treating you today
89,"WIEIAD being very far in atypical anorexia recovery! Enjoying UNHEALTHY Pizza (!!) Edition!! ♡Today I challenged a huge food rule and I feel so powerful! Break your rules, because breaking rules breaks the ED.",Positive,wieiad being very far atypical anorexia enjoying unhealthy pizza challenged huge food rule and feel break your because breaking rules breaks the
90,anorexia starts tomorrow fr this time,Negative,anorexia starts tomorrow this time
91,"im curious, is this kind of delusion the inevitable fate for all anorexics or does it just depend on the individual?",Neutral,this kind delusion the inevitable fate for all anorexics does just depend the
92,it's funny how these fat posi ppl say that their weight & size is immutable but judge the FUCK out of anorexics & poke at their bodies cause they know they can in fact change theirs. fucking raging jealousy just to plop societal entitlement ontop of it all. smh.,Negative,funny how these fat posi ppl say that their weight size immutable but judge the fuck out anorexics poke their bodies cause they know they can fact change fucking raging jealousy just plop societal entitlement ontop
93,"""it went fine"" yet here u are, anorexic, mentally ill and having a child under the age of 18 — Im not anorexic ur stupid plus its not my moms fault . I have my OWN issues it has nothing to do with her.",Neutral,went yet here mentally ill and having child under the age not anorexic stupid plus its not moms fault have own issues has nothing with
94,Anorexic? I see it as a compliment,Negative,see compliment
95,yesterday’s eats! protein pudding (120 cals cause i threw some away) and leftovers of my anorexic miso soup from yesterday (16 cals) 🤍,Negative,protein pudding cals cause threw some and leftovers anorexic miso soup from yesterday
96,"gonna go on my ""falling down"" arc and reinstall tinder to pound as much low quality 4-7/10 anorexic pinoy pussy as I possibly can and spawn numerous moro island mongrels whose childhoods i will NOT be involved with (nigmaxxing)",Negative,gonna arc and reinstall tinder pound much low quality anorexic pinoy pussy possibly can and spawn numerous moro island mongrels whose childhoods will not involved with
97,the widespread appreciation anorexics have for mukbangs is really special,Positive,the widespread appreciation anorexics have for mukbangs really special
98,anorexic allegations is crazy she is not you,Negative,anorexic allegations crazy she not you
99,no bro i'm not anorexic im starvemaxxing,Negative,bro not anorexic starvemaxxing
100,“Does anorexic penis exi” YES!!!!!!!! MY GODDD YESSSS!!!!!,Positive,anorexic penis goddd
101,gym bro son + anorexic daughter 😍,Positive,gym bro son anorexic daughter
102,My dad saw my bowl and went on a small rant about how this was too many potato chips. Then he looked at the back of the bag at the calories I think?? Why is he being anorexic FOR me?? 😭,Negative,dad saw bowl and went small rant about how this was too many potato then looked the back the bag the calories why being anorexic for
103,the best anorexic fr fr 🤭🤭🤭🤭,Neutral,the best anorexic
104,Yeah I'm overweight,Neutral,yeah overweight
105,once i get to bmi 15 i’m just gonna maintain fr .. why am i excited to semi recover ,Positive,once get bmi just gonna maintain why excited semi recover
106,"Maybe having all the offensive linemen being 350 pounds is a bad idea. They are all slow and overweight, they can’t move. NFL OL’s aren’t this big for a reason",Negative,maybe having all the offensive linemen being 350 pounds bad they are all slow and they nfl this big for reason
107,At what bmi does someone genuinely love me,Neutral,what bmi does someone genuinely love
108,"might quit fortnite. can't find a good and stable duo. and just need to get my irl life together tbh. im overweight, and i'm short.",Negative,might quit find good and stable and just need get irl life together and
109,You are not alone if you experience challenging emotions during meals. The best thing to do when your body is asking for food is to feed it!,Positive,you are not alone you experience challenging emotions during the best thing when your body asking for food feed
110,"""The extant research is, however, limited to either neurotypical samples or autistic individuals in clinical contexts (e.g., eating disorders, weight management).""",Negative,extant research limited either neurotypical samples autistic individuals clinical contexts eating weight
